{
  "$schema": "https://json-schema.org/draft/2020-12/schema",
  "$id": "https://getmaipai.github.io/shared/spec/schemas/likeness-ask.schema.json",
  "title": "LikenessAsk",
  "description": "PERUSE-2026-10-25. One ask for a pictured household adult's consent to a single picture or video of adult content that looks like them. The pictured adult reads the exact prompt on a card and clicks Consent or Decline; one ask covers one generation. The prompt text is never in this record, only its SHA-256, so the record can be kept as the audit trail.",
  "type": "object",
  "additionalProperties": false,
  "required": [
    "id",
    "subject_person_id",
    "requester_person_id",
    "medium",
    "way",
    "state",
    "prompt_sha256",
    "source",
    "created_at",
    "updated_at",
    "hlc"
  ],
  "properties": {
    "id": {
      "type": "string",
      "minLength": 1
    },
    "subject_person_id": {
      "type": "string",
      "minLength": 1,
      "description": "The household adult who is asked."
    },
    "requester_person_id": {
      "type": "string",
      "minLength": 1,
      "description": "The adult who asked for the picture or video."
    },
    "medium": {
      "type": "string",
      "enum": [
        "picture",
        "video"
      ]
    },
    "way": {
      "type": "string",
      "enum": [
        "style"
      ],
      "description": "style: a saved style of the person. Adult content from a photo is never allowed."
    },
    "state": {
      "type": "string",
      "enum": [
        "waiting",
        "approved",
        "declined",
        "expired",
        "consumed",
        "cancelled"
      ]
    },
    "prompt_sha256": {
      "type": "string",
      "pattern": "^[0-9a-f]{64}$",
      "description": "SHA-256 of the exact prompt shown on the card."
    },
    "source": {
      "type": "string",
      "enum": [
        "chat",
        "editor"
      ],
      "description": "Where the request was made; this is the record provenance."
    },
    "decided_at": {
      "type": "string",
      "format": "date-time"
    },
    "decided_by": {
      "type": "string",
      "enum": [
        "subject",
        "requester"
      ],
      "description": "Which of the two accounts the click was made from. Home does not check who holds the device."
    },
    "consumed_at": {
      "type": "string",
      "format": "date-time"
    },
    "expires_at": {
      "type": "string",
      "format": "date-time"
    },
    "created_at": {
      "type": "string",
      "format": "date-time"
    },
    "updated_at": {
      "type": "string",
      "format": "date-time"
    },
    "hlc": {
      "type": "string",
      "pattern": "^[0-9]+:[0-9]+:[a-z0-9]{6,}$",
      "description": "Hybrid logical clock: wall_ms:counter:node (7.3)."
    }
  }
}
