{
  "id": "ask_01h8x0ask00001",
  "subject_person_id": "person_iris",
  "requester_person_id": "person_sage",
  "medium": "picture",
  "way": "style",
  "state": "waiting",
  "prompt_sha256": "9f86d081884c7d659a2feaa0c55ad015a3bf4f1b2b0b822cd15d6c15b0f00a08",
  "source": "chat",
  "expires_at": "2026-10-26T13:10:00.000Z",
  "created_at": "2026-10-26T13:00:00.000Z",
  "updated_at": "2026-10-26T13:00:00.000Z",
  "hlc": "1792242000000:0:hub001"
}
