{
  "id": "ask_01h8x0ask00002",
  "subject_person_id": "person_iris",
  "requester_person_id": "person_sage",
  "medium": "video",
  "way": "style",
  "state": "approved",
  "prompt_sha256": "60303ae22b998861bce3b28f33eec1be758a213c86c93c076dbe9f558c11c752",
  "source": "chat",
  "decided_at": "2026-10-26T13:02:00.000Z",
  "decided_by": "subject",
  "expires_at": "2026-10-26T17:02:00.000Z",
  "created_at": "2026-10-26T13:00:00.000Z",
  "updated_at": "2026-10-26T13:02:00.000Z",
  "hlc": "1792242120000:0:hub001"
}
